id_str,favorite_count,retweet_count,statuses_count,user_favourites_count,list_count,friends_count,followers_count,full_text
709918798883774466,3434,1069,12577,145790,5733,17,8824227,Meet Watson. He's a Suzuki Tickleboop. Leader of a notorious biker gang. Only one ear functional. 12/10 snuggable af https://t.co/R1gLc5vDqG
710117014656950272,5384,1955,12577,145790,5733,17,8824227,This pupper got her hair chalked for her birthday. Hasn't told her parents yet. Rebellious af. 11/10 very nifty https://t.co/h1OX2mLtxV
710140971284037632,2707,862,12577,145790,5733,17,8824228,This is Tater. His underbite is fierce af. Doesn't give a damn about your engagement photo. 8/10 https://t.co/nLuPY3pY12
710153181850935296,2855,875,12577,145790,5733,17,8824228,This is Lacy. She's tipping her hat to you. Daydreams of her life back on the frontier. 11/10 would pet so well https://t.co/fG5Pk3Et1I
710269109699739648,2355,1096,12577,145790,5733,17,8824228,"The squad is back for St. Patrick's Day! â˜˜ ðŸ’š
13/10 for all https://t.co/OcCDb2bng5"
710272297844797440,4452,1229,12577,145790,5733,17,8824228,We ðŸ‘ðŸ» only ðŸ‘ðŸ» rate ðŸ‘ðŸ» dogs. Pls stop sending in non-canines like this Dutch Panda Worm. This is infuriating. 11/10 https://t.co/odfLzBonG2
710283270106132480,2114,514,12577,145790,5733,17,8824228,This is Gunner. He's a Figamus Newton. King of the peek-a-boo. Cool jeans. 11/10 https://t.co/ONuBILIYXZ
710588934686908417,4458,1827,12577,145790,5733,17,8824228,This is Beemo. He's a Chubberflop mix. 12/10 would cross the world for https://t.co/kzMVMU8HBV
710658690886586372,2266,549,12577,145790,5733,17,8824228,Here's a brigade of puppers. All look very prepared for whatever happens next. 80/80 https://t.co/0eb7R1Om12
710833117892898816,2643,520,12577,145790,5733,17,8824228,Say hello to Sora. She's an Egyptian Pumpernickel. Mesmerizing af. 12/10 would bring home to mom https://t.co/PmTR4kxZkq
710844581445812225,2503,672,12577,145790,5733,17,8824228,This is Staniel. His selfie game is strong af. 10/10 I'd snapchat with Staniel https://t.co/UgkTw7TKyM
710997087345876993,4495,1364,12577,145790,5733,17,8824229,Meet Milo and Amos. They are the best of pals. Both 12/10 would pet at the same time https://t.co/Mv37BHEyyD
711008018775851008,2952,601,12577,145790,5733,17,8824229,This is Chuckles. He had a balloon but he accidentally let go of it and it floated away. 11/10 hang in there pupper https://t.co/68iNM7B5gW
711306686208872448,3246,721,12577,145790,5733,17,8824229,What hooligan sent in pictures w/out a dog in them? Churlish af. 3/10 just bc that's a neat fluffy bean bag chair https://t.co/wcwoGOkZvz
711363825979756544,3586,1110,12577,145790,5733,17,8824229,"""Please, no puparazzi"" 11/10 https://t.co/nJIXSPfedK"
711652651650457602,3790,898,12577,145790,5733,17,8824229,This is Gary. He just wanted to say hi. 9/10 very personable pup https://t.co/Sk3CbhmKSW
711694788429553666,32324,17986,12577,145790,5733,17,8824229,Oh. My. God. 13/10 magical af https://t.co/Ezu6jQrKAZ
711732680602345472,8683,4025,12577,145790,5733,17,8824229,I want to hear the joke this dog was just told. 10/10 https://t.co/1KiuZqqOD4
711743778164514816,2789,970,12577,145790,5733,17,8824229,Meet Roosevelt. He's calculating the best case scenario if he drops out instead of doing math hw. 11/10 relatable af https://t.co/QcSIRDpfVg
711968124745228288,7919,2255,12577,145790,5733,17,8824229,Meet Winston. He's trapped in a cup of coffee. Poor pupper. 10/10 someone free him https://t.co/2e6cUtKUuc
711998809858043904,0,125,12577,145790,5733,17,8824229,RT @twitter: @dog_rates Awesome Tweet! 12/10. Would Retweet. #LoveTwitter https://t.co/j6FQGhxYuN
712065007010385924,2225,609,12577,145790,5733,17,8824229,This is Chester. He's clearly in charge of the other dogs. Weird ass paws. Not fit for fetch. 6/10 would still pet https://t.co/o2GvskrhHt
712085617388212225,3217,476,12577,145790,5733,17,8824229,"Say hello to Olive and Ruby. They are best buddies. Both 11/10 
1 like = 1 buddy https://t.co/yagmFdKlyL"
712092745624633345,2893,870,12577,145790,5733,17,8824229,This is Steven. He's inverted af. Also very helpful. Scans anything you want for free. Takes him a while tho. 7/10 https://t.co/tA0ZiQ7JcG
712097430750289920,3717,1014,12577,145790,5733,17,8824229,I can't even comprehend how confused this dog must be right now. 10/10 https://t.co/8AGcQ4hIfK
712438159032893441,5230,1537,12577,145790,5733,17,8824229,This is Kane. He's a semi-submerged Haitian Huffleplop. Happy af. Sick waterfall. 11/10 would pat head approvingly https://t.co/7zjEC501Ul
712668654853337088,4107,1193,12577,145790,5733,17,8824229,Say hello to Sunny and Roxy. They pull things out of water together. 10/10 for both https://t.co/88aedAmxcl
712717840512598017,12122,4874,12577,145790,5733,17,8824229,Please don't send in any more polar bears. We only rate dogs. Thank you... 10/10 https://t.co/83RGhdIQz2
712809025985978368,18727,6601,12577,145790,5733,17,8824229,This is Stubert. He just arrived. 10/10 https://t.co/HVGs5aAKAn
713175907180089344,4383,1446,12577,145790,5733,17,8824229,Say hello to Opie and Clarkus. Clarkus fell asleep so Opie buried him. Ruthless af 10/10 for both https://t.co/xT7XaY4gnW
713177543487135744,7097,2783,12577,145790,5733,17,8824229,This is Lance. Lance doesn't give a shit. 10/10 we should all be more like Lance https://t.co/SqnG9Ap28J
713411074226274305,4364,1275,12577,145790,5733,17,8824229,Here we see an extremely rare Bearded Floofmallow. Only a few left in the wild. 11/10 would pet with a purpose https://t.co/jVJJKlPbvq
713761197720473600,4780,1342,12577,145790,5733,17,8824229,This is Piper. She would really like that tennis ball core. Super sneaky tongue slip. 12/10 precious af https://t.co/QP6GHi5az9
713900603437621249,2780,727,12577,145790,5733,17,8824229,Happy Saturday here's 9 puppers on a bench. 99/90 good work everybody https://t.co/mpvaVxKmc1
713919462244790272,3237,777,12577,145790,5733,17,8824229,This is Kanu. He's a Freckled Ticonderoga. Simply flawless. 12/10 would perform an elaborate heist to capture https://t.co/7vyAzIURrE
714141408463036416,4247,1368,12577,145790,5733,17,8824229,"I know we only rate dogs, but since it's Easter I guess we could rate a bunny for a change. 10/10 petable as hell https://t.co/O2RlKXigHu"
714214115368108032,2235,852,12577,145791,5733,17,8824864,Happy Easter from the squad! ðŸ‡ðŸ¶ 13/10 for all https://t.co/YMx4KWJUAB
714251586676113411,3214,820,12577,145790,5733,17,8824229,This is Thumas. He hates potted plants. 8/10 wtf Thumas https://t.co/rDVueNIcEi
714258258790387713,2979,710,12577,145790,5733,17,8824229,"Meet Travis and Flurp. Travis is pretty chill but Flurp can't lie down properly. 10/10 &amp; 8/10
get it together Flurp https://t.co/Akzl5ynMmE"
714606013974974464,3567,906,12577,145790,5733,17,8824229,Here are two lil cuddly puppers. Both 12/10 would snug like so much https://t.co/zO4eb7C4tG
714631576617938945,3216,973,12577,145790,5733,17,8824229,This is Benedict. He's a feisty pup. Needs a brushing. Portable af. Looks very angry actually. 4/10 might not pet https://t.co/3oeFfHjv0Z
714957620017307648,4064,1383,12577,145790,5733,17,8824229,This is Curtis. He's an Albino Haberdasher. Terrified of dandelions. They really spook him up. 10/10 it'll be ok pup https://t.co/s8YcfZrWhK
714982300363173890,3667,1014,12577,145790,5733,17,8824229,This is Calbert. He forgot to clear his Google search history. 9/10 rookie mistake Calbert https://t.co/jRm5J3YCmj
715009755312439296,4078,1202,12577,145790,5733,17,8824229,This is Siba. She's remarkably mobile. Very sleepy as well. 12/10 would happily transport https://t.co/TjnI33RE1i
715200624753819648,5049,1841,12577,145790,5733,17,8824229,This is Michelangelope. He's half coffee cup. Rare af. 12/10 would hug until someone stopped me https://t.co/tvVDY0G911
715220193576927233,2381,637,12577,145790,5733,17,8824229,This is Nico. His selfie game is strong af. Excellent use of a sneaky tongue slip. 10/10 star material https://t.co/1OBdJkMOFx
715342466308784130,2989,683,12577,145790,5733,17,8824229,This is Oscar. He's a world renowned snowball inspector. It's a ruff job but someone has to do it. 10/10 great guy https://t.co/vSufMAKm3C
715360349751484417,5376,1530,12577,145790,5733,17,8824229,This is Bertson. He just wants to say hi. 11/10 would boop nose https://t.co/hwv7Wq6gDA
715680795826982913,4229,1577,12577,145790,5733,17,8824229,This is Zeus. He's downright fabulous. 12/10 https://t.co/sSugyyRuTp
715696743237730304,3843,1263,12577,145790,5733,17,8824229,Meet Toby. He's a Lithuanian High-Steppin Stickeroo. One of the more accomplished Stickeroos around. 10/10 so nifty https://t.co/cYPHuJYTjC
715733265223708672,4572,1653,12577,145790,5733,17,8824229,This is a taco. We only rate dogs. Please only send in dogs. Dogs are what we rate. Not tacos. Thank you... 10/10 https://t.co/cxl6xGY8B9
715928423106027520,3135,859,12577,145790,5733,17,8824229,This is Bubbles. He's a Yorkshire Piccolope. 11/10 would snug aggressively https://t.co/3BhMojONxq
716080869887381504,6649,1858,12577,145790,5733,17,8824229,Here's a super majestic doggo and a sunset 11/10 https://t.co/UACnoyi8zu
716285507865542656,2720,1032,12577,145790,5733,17,8824229,This is Stephanus. She stays woke. 12/10 https://t.co/WIWabMngQZ
716439118184652801,2334,204,12577,145790,5733,17,8824229,This is Bluebert. He just saw that both #FinalFur match ups are split 50/50. Amazed af. 11/10 https://t.co/Kky1DPG4iq
716791146589110272,8026,1546,12577,145790,5733,17,8824229,Meet Jennifur. She's supposed to be navigating. Not even buckled up. Insubordinate &amp; churlish. 11/10 would still pet https://t.co/h0trcJohYO
716802964044845056,4209,1146,12577,145790,5733,17,8824229,This is Link. He struggles with couches. 10/10 would assist https://t.co/SbX4e6Yg3o
717009362452090881,3184,942,12577,145790,5733,17,8824230,This is Smokey. He's having some sort of existential crisis. 10/10 hang in there pupper https://t.co/JmgF4dMpw0
717047459982213120,6175,1887,12577,145790,5733,17,8824230,This is FlÃ¡vio (pronounced Baxter). He's a Benesnoop Cumberdog. Super rare. Symmetrical. 12/10 would pet so well https://t.co/fGgleFiBPq
717421804990701568,3102,822,12577,145790,5733,17,8824230,This is Ebby. She's a Zimbabwean Feta. Embarrassed by ridiculously squishy face. 9/10 would squeeze softly https://t.co/LBJqxMGaHi
717537687239008257,5672,1815,12577,145790,5733,17,8824230,People please. This is a Deadly Mediterranean Plop T-Rex. We only rate dogs. Only send in dogs. Thanks you... 11/10 https://t.co/2ATDsgHD4n
717790033953034240,2826,1087,12577,145790,5733,17,8824230,"Here's a badass mystery pupper. You weren't aware that you owe him money, but you do. 10/10 shades sick af https://t.co/fv9e9AtzSG"
717841801130979328,2413,592,12577,145791,5733,17,8824865,This is Barclay. His father was a banana. 11/10 appeeling af https://t.co/ucOEfr2rjV
718234618122661888,3799,968,12577,145790,5733,17,8824230,This is Suki. She was born with a blurry tail (unfortunate). Next level tongue tho. 11/10 nifty hardwood https://t.co/05S8oYztgb
718246886998687744,1874,487,12577,145790,5733,17,8824230,This is Alexanderson. He's got a weird ass birth mark. Dreadful at fetch. Won't eat kibble. 3/10 wtf @Target https://t.co/FmxOpf2Sgl
718454725339934721,4771,1480,12577,145790,5733,17,8824230,"This pic is old but I hadn't seen it until today and had to share. Creative af. 13/10 very good boy, would pet well https://t.co/4kD16wMA1Z"
718460005985447936,2648,514,12577,145790,5733,17,8824230,Meet Bowie. He's listening for underground squirrels. Smart af. Left eye is considerably magical. 9/10 would so pet https://t.co/JyNmyjy3fe
718540630683709445,2409,997,12577,145790,5733,17,8824230,Get you a pup that can do both. 10/10 https://t.co/zSbyvm62xZ
718613305783398402,2398,472,12577,145790,5733,17,8824230,This is Carper. He's a Tortellini Angiosperm. In desperate need of a petting. 11/10 would hug softly https://t.co/lK9YDkRzPj
718631497683582976,18545,7871,12577,145790,5733,17,8824230,We normally don't rate marshmallows but this one appears to be flawlessly toasted so I'll make an exception. 10/10 https://t.co/D9jbbmPmos
718939241951195136,5153,1721,12577,145790,5733,17,8824230,This is Otis. Everybody look at Otis. 12/10 would probably faint while petting https://t.co/I9qoe1uEih
718971898235854848,3425,1053,12577,145790,5733,17,8824230,This is Sadie. She is prepared for battle. 10/10 https://t.co/JRckDkZVRT
719332531645071360,3366,928,12577,145790,5733,17,8824230,This is Pippa. She managed to start the car but is waiting for you to buckle up before driving. Responsible af 11/10 https://t.co/htrlmC7saz
719339463458033665,4356,1205,12577,145790,5733,17,8824230,Say hello to Lucy and Sophie. They think they're the same size. Both 10/10 would snug at same time https://t.co/HW50zkcf2R
719367763014393856,2745,729,12577,145790,5733,17,8824230,Meet Sid &amp; Murphy. Murphy floats alongside Sid and whispers motivational quotes in his ear. Magical af. Both 11/10 https://t.co/7mmjyearQW
719551379208073216,4958,1858,12577,145790,5733,17,8824230,This is Harnold. He accidentally opened the front facing camera. 10/10 get it together Harnold https://t.co/S6JHaSMtln
719704490224398336,4454,1396,12577,145790,5733,17,8824230,This is Clyde. He's making sure you're having a good train ride. 12/10 great pupper https://t.co/y206kWHAj0
719991154352222208,4749,1705,12577,145790,5733,17,8824230,This doggo was initially thrilled when she saw the happy cartoon pup but quickly realized she'd been deceived. 10/10 https://t.co/mvnBGaWULV
720043174954147842,4825,1967,12577,145790,5733,17,8824230,This is Neptune. He's a Snowy Swiss Mountain Floofapolis. Cheeky wink. Tongue nifty af. 11/10 would pet so firmly https://t.co/SoZq2Xoopv
720059472081784833,3792,1104,12577,145790,5733,17,8824230,This is Charleson. He lost his plunger. Looked everywhere. Can't find it. So sad. 9/10 would comfort https://t.co/pRHX8yn9Yu
720340705894408192,2811,958,12577,145790,5733,17,8824230,This is Derek. He just got balled on. Can't even get up. Poor thing. 10/10 hang in there pupper https://t.co/BIRRF3bcWH
720389942216527872,6246,2450,12577,145790,5733,17,8824230,This is RalphÃ©. He patrols the lake. Looking for babes. 11/10 https://t.co/Pb6iMmo0wk
720415127506415616,4044,1469,12577,145790,5733,17,8824230,Garden's coming in nice this year. 10/10 https://t.co/5Lra3e4rrw
720775346191278080,2413,647,12577,145790,5733,17,8824230,This is Berkeley. He's in a predicament. 10/10 someone help him https://t.co/XSEXdQupej
720785406564900865,3053,752,12577,145790,5733,17,8824230,This is Archie. He hears everything you say. Doesn't matter where you are. 12/10 https://t.co/0l4I8famYp
721001180231503872,2484,598,12577,145790,5733,17,8824230,This is Oliver. Bath time is upon him. His fear of the wetness postpones his ultimate pupper destiny. 11/10 https://t.co/AFzzKqR4tT
721503162398597120,4532,1796,12577,145790,5733,17,8824230,This is Panda. He's happy af. 11/10 https://t.co/IOAk9i4UvE
722613351520608256,4872,1605,12577,145790,5733,17,8824230,Meet Schnitzel. He's a Tropicana Floofboop. Getting too big for his favorite basket. 12/10 just so damn fluffy https://t.co/qjd0UJKYUY
722974582966214656,4036,1532,12577,145790,5733,17,8824230,Happy 4/20 from the squad! 13/10 for all https://t.co/eV1diwds8a
723179728551723008,5214,1825,12577,145790,5733,17,8824230,This is Jangle. She's addicted to broccoli. It's the only thing she cares about. Tragic af. 8/10 get help pup https://t.co/8dNWp1cSEa
723673163800948736,2958,872,12577,145790,5733,17,8824230,This is Ivar. She is a badass Viking warrior. Will sack your village. 10/10 savage af https://t.co/Dz6MiVssVU
723688335806480385,7534,2875,12577,145790,5733,17,8824230,This is Reginald. He starts screaming at random. 12/10 cuddly af https://t.co/YgNuDQbv89
723912936180330496,3817,1211,12577,145790,5733,17,8824230,This is Sugar. She's a Bolivian Superfloof. Spherical af. 12/10 would never let go of https://t.co/AhMfUu6Onm
724004602748780546,4110,1508,12577,145790,5733,17,8824230,This is Luther. He saw a ghost. Spooked af. 11/10 hang in there pupper https://t.co/EdKG43VvEl
724046343203856385,2611,544,12577,145790,5733,17,8824230,"This is Sarge. Not even he knows what his tongue is doing, but it's pretty damn spectacular. 10/10 https://t.co/pIQEdbBxdL"
724049859469295616,4253,1742,12577,145790,5733,17,8824230,This is Kreggory. He just took a look at his student debt. 10/10 can't even comprehend it https://t.co/XTsZTgilnT
724405726123311104,5189,1617,12577,145790,5733,17,8824230,This is Ashleigh. She's having Coachella withdrawals. Didn't even go tho. 10/10 stay strong pupper https://t.co/nRUaKWnJfH
724771698126512129,2306,624,12577,145790,5733,17,8824230,Nothin better than a doggo and a sunset. 11/10 https://t.co/JlFqOhrHEs
724983749226668032,3663,1282,12577,145790,5733,17,8824230,This is Fred-Rick. He dabbles in parkour. The elevation gives him power. 12/10 hopefully visiting a mailbox near you https://t.co/qFqLtudIiD
725729321944506368,5106,1749,12577,145790,5733,17,8824230,This is Lola. She's a Butternut Splishnsplash. They are known to be ferocious af. 12/10 would absolutely still pet https://t.co/adQt5a6TZU
725786712245440512,4100,1341,12577,145790,5733,17,8824230,Say hello to Lillie. She's a Rutabagan Floofem. Poor pupper ate and then passed out. 11/10 relatable af https://t.co/uIdGqug9rw
725842289046749185,6948,2615,12577,145790,5733,17,8824230,This is Colby. He's currently regretting all those times he shook your hand for an extra treat. 12/10 https://t.co/vtVHtKFtBH
726224900189511680,4349,1120,12577,145790,5733,17,8824230,I'm getting super heckin frustrated with you all sending in non canines like this ostrich. We only rate dogs... 9/10 https://t.co/Rgbni2Ns8z
726828223124897792,3498,984,12577,145790,5733,17,8824230,This is Bloop. He's a Phoenician Winnebago. Tongue is just wow. That box is all he has (tragic). 12/10 would caress https://t.co/DWNrPPXgHA
726887082820554753,3770,1495,12577,145790,5733,17,8824230,This is Blitz. He's a new dad struggling to cope mentally with the pressures of being a father. Sick shades 10/10 https://t.co/2AVcJ2BZsy
726935089318363137,6745,2391,12577,145790,5733,17,8824230,This is Sprout. He's just precious af. 12/10 I'd do anything for Sprout https://t.co/DxlX1yTVYY
727175381690781696,3847,1359,12577,145790,5733,17,8824230,This is Karll. He just wants to go kayaking. 10/10 please someone take Karll kayaking already https://t.co/vXLkvyNQHp
727286334147182592,3003,796,12577,145790,5733,17,8824230,I swear to god if we get sent another Blue Madagascan Peacock we'll deactivate. We ðŸ‘ Only ðŸ‘ Rate ðŸ‘ Dogs... 9/10 https://t.co/bbta2Q4URK
727314416056803329,3280,723,12577,145790,5733,17,8824230,This pupper was about to explain where that dirt came from but then decided against it. 11/10 https://t.co/SbaelU6zRs
727524757080539137,4400,1193,12577,145790,5733,17,8824230,This pupper had to undergo emergency haircut surgery so he could hear again. 10/10 miraculous af https://t.co/fUyDIFkBwx
727644517743104000,5763,1712,12577,145790,5733,17,8824230,Here's a doggo struggling to cope with the winds. 13/10 https://t.co/qv3aUwaouT
727685679342333952,2912,631,12577,145790,5733,17,8824230,This is Cilantro. She's a Fellation Gadzooks. Eyes are super magical af. 12/10 could get lost in https://t.co/yJ26LNuyj5
728015554473250816,4046,1084,12577,145790,5733,17,8824230,This is Rueben. He has reached ultimate pupper zen state. 11/10 tranquil af https://t.co/Z167HgtnBi
728035342121635841,4487,1635,12577,145790,5733,17,8824230,This is all I want in my life. 12/10 for super sleepy pupper https://t.co/4RlLA5ObMh
728046963732717569,4224,1176,12577,145790,5733,17,8824230,This is Raymond. He controls fountains with his tongue. 11/10 pretty damn magical https://t.co/9aMxSbOaAZ
728387165835677696,3637,944,12577,145790,5733,17,8824230,"This is Enchilada (yes, that's her real name). She's a Low-Cruisin Plopflopple. Very rare. Only a few left. 12/10 https://t.co/SiaiTWgsfP"
728409960103686147,4827,1958,12577,145790,5733,17,8824230,This is Wallace. He's a skater pup. He said see ya later pup. Can easily do a kick flip. Gnarly af. 10/10 v petable https://t.co/5i8fORVKgr
728653952833728512,3257,1016,12577,145790,5733,17,8824230,This is Coleman. Somebody needs to tell him that he's sitting in chairs wrong. 8/10 https://t.co/O10zjJ2Ixs
728751179681943552,2712,665,12577,145790,5733,17,8824230,This is Flurpson. He can't believe it's not butter. 10/10 https://t.co/XD3ort1PsE
728760639972315136,4593,1665,12577,145791,5733,17,8824865,"When you're way too slow for the ""down low"" portion of a high five. 13/10 https://t.co/Cofwoy7Vpq"
728986383096946689,3093,806,12577,145790,5733,17,8824230,"This is Puff. He started out on the streets (first pic), but don't let the new smile fool you, still tough af. 11/10 https://t.co/kiuXRXcg4B"
729113531270991872,1842,316,12577,145790,5733,17,8824230,"""Challenge accepted""
10/10 https://t.co/vNjvr5Bl9u"
729463711119904772,5693,2274,12577,145790,5733,17,8824230,Meet Pupcasso. You can't afford his art. 13/10 talented af https://t.co/f2VUpy4WO0
729823566028484608,3907,1224,12577,145790,5733,17,8824230,This is Stefan. He's a downright remarkable pup. 13/10 https://t.co/Ebjt6Y4fMh
729838605770891264,1689,374,12577,145790,5733,17,8824230,"""Challenge completed"" 
(pupgraded to 12/10) https://t.co/85dTK7XCXB"
729854734790754305,3959,1102,12577,145790,5733,17,8824230,Say hello to Ollie. He conducts this train. He also greets you as you enter. Kind af. 11/10 would pet so firmly https://t.co/jVxOGKEU0z
730196704625098752,4758,1861,12577,145790,5733,17,8824230,This is Charles. He's camera shy. Tail longer than average. Doesn't look overwhelmingly fluffy. 6/10 would still pet https://t.co/rXvcElhoog
730211855403241472,3754,1039,12577,145790,5733,17,8824230,This is Ziva. She doesn't know how her collar works. 11/10 would totally fix for her https://t.co/K7pthJXjWE
730427201120833536,3431,1026,12577,145790,5733,17,8824230,This is Crystal. She's flawless. Really wants to be a frat bro. 11/10 who does she even know here? https://t.co/WyqNFvEulG
730573383004487680,4810,2091,12577,145790,5733,17,8824230,This is Rooney. He can't comprehend glass. 10/10 it'll be ok pupper https://t.co/CnUl2uDBBV
730924654643314689,6042,1940,12577,145790,5733,17,8824230,We only rate dogs. Pls stop sending non-canines like this Bulgarian Eyeless Porch Bear. This is unacceptable... 9/10 https://t.co/2yctWAUZ3Z
731156023742988288,3770,1245,12577,145790,5733,17,8824230,Say hello to this unbelievably well behaved squad of doggos. 204/170 would try to pet all at once https://t.co/yGQI3He3xv
731285275100512256,3428,975,12577,145790,5733,17,8824230,This is Solomon. He's a Beneroo Cumberflop. 12/10 would hug passionately https://t.co/5phLAnGPTP
732005617171337216,14643,5289,12577,145790,5733,17,8824230,This is Larry. He has no self control. Tongue still nifty af tho 11/10 https://t.co/ghyT4Ubk1r
732375214819057664,7948,2468,12577,145790,5733,17,8824230,This is Kyle (pronounced 'Mitch'). He strives to be the best doggo he can be. 11/10 would pat on head approvingly https://t.co/aA2GiTGvlE
732585889486888962,3605,766,12577,145790,5733,17,8824230,"When your teacher agreed on 10,000 RTs and no final but after 24 hours you only have 37... 10/10 https://t.co/sVnJfWVjUp"
732726085725589504,3494,875,12577,145790,5733,17,8824230,This is Aldrick. He looks wise af. Also exceptionally fluffy. Only two legs tho (unfortunate). 11/10 would still hug https://t.co/QwiCVLPMNL
732732193018155009,2390,525,12577,145790,5733,17,8824230,This is Ralpher. He's an East Guinean Flop Dog. Cuddly af. 12/10 https://t.co/rVOLuNRpjH
733109485275860992,49432,16539,12577,145790,5733,17,8824230,"Like father (doggo), like son (pupper). Both 12/10 https://t.co/pG2inLaOda"
733460102733135873,4121,1254,12577,145790,5733,17,8824229,This is Hermione. Her face is as old as time. Appears fluffy af tho. 11/10 pretty damn majestic https://t.co/0b41Q4DKCA
733482008106668032,3084,932,12577,145790,5733,17,8824229,"""Ello this is dog how may I assist"" ...10/10 https://t.co/jeAENpjH7L"
733822306246479872,3606,1006,12577,145790,5733,17,8824229,This is Moose. He's a Polynesian Floofer. Dapper af. 10/10 would pet diligently https://t.co/mVfqRdppTL
733828123016450049,3520,764,12577,145790,5733,17,8824229,This is Terry. The harder you hug him the farther his tongue sticks out. 10/10 magical af https://t.co/RFToQQI8fJ
734776360183431168,2461,528,12577,145790,5733,17,8824229,This is Livvie. Someone should tell her it's been 47 years since Woodstock. Magical eyes tho 11/10 would stare into https://t.co/qw07vhVHuO
734787690684657664,12331,6174,12577,145790,5733,17,8824229,This dog is more successful than I will ever be. 13/10 absolute legend https://t.co/BPoaHySYwA
734912297295085568,2707,516,12577,145790,5733,17,8824229,This is Jax. He's a literal fluffball. Sneaky tongue slip. 10/10 would pet nonstop https://t.co/9MGouPwQmK
735137028879360001,3077,957,12577,145790,5733,17,8824229,Meet Buckley. His family &amp; some neighbors came over to watch him perform but he's nervous af. 9/10 u got this pupper https://t.co/5bdCpPlno9
735256018284875776,3276,862,12577,145790,5733,17,8824229,This is Kellogg. He accidentally opened the front facing camera. 8/10 get it together doggo https://t.co/MRYv7nDPyS
735274964362878976,12822,4934,12577,145790,5733,17,8824229,We only rate dogs. Please stop sending in your 31 year old sons that won't get out of your house. Thank you... 11/10 https://t.co/aTU53NNUkt
735635087207878657,6070,2313,12577,145790,5733,17,8824229,This is Dakota. He hasn't grow into his skin yet. 11/10 would squeeze softly https://t.co/IvFSlNXpgj
