id_str,favorite_count,retweet_count,statuses_count,user_favourites_count,list_count,friends_count,followers_count,full_text
777641927919427584,0,4234,12577,145790,5733,17,8824231,RT @dog_rates: This is Arnie. He's a Nova Scotian Fridge Floof. Rare af. 12/10 https://t.co/lprdOylVpS
777684233540206592,11263,2945,12577,145790,5733,17,8824231,"""Yep... just as I suspected. You're not flossing."" 12/10 and 11/10 for the pup not flossing https://t.co/SuXcI9B7pQ"
777885040357281792,6363,1635,12577,145790,5733,17,8824231,This is Wesley. He's clearly trespassing. Seems rather h*ckin violent too. Weaponized forehead. 3/10 wouldn't let in https://t.co/pL7wbMRW7M
778027034220126208,6568,1615,12577,145790,5733,17,8824231,This is Sophie. She's a Jubilant Bush Pupper. Super h*ckin rare. Appears at random just to smile at the locals. 11.27/10 would smile back https://t.co/QFaUiIHxHq
778039087836069888,8539,2651,12577,145790,5733,17,8824231,Evolution of a pupper yawn featuring Max. 12/10 groundbreaking stuff https://t.co/t8Y4x9DmVD
778286810187399168,10407,3303,12577,145790,5733,17,8824231,This is Stanley. He has too much skin. Isn't happy about it. Quite pupset actually. Still 11/10 would comfort https://t.co/hhTfnPrWfb
778383385161035776,5860,1106,12577,145790,5733,17,8824231,This is Nala. She's a future Dogue model. Won't respond to my texts. 13/10 would be an honor to pet https://t.co/zP1IvAATWv
778396591732486144,0,12259,12577,145790,5733,17,8824231,RT @dog_rates: This is an East African Chalupa Seal. We only rate dogs. Please only send in dogs. Thank you... 10/10 https://t.co/iHe6liLwWR
778408200802557953,13681,4340,12577,145790,5733,17,8824231,RIP Loki. Thank you for the good times. You will be missed by many. 14/10 https://t.co/gJKD9pst5A
778624900596654080,4654,1012,12577,145790,5733,17,8824231,This is Penny. She's a sailor pup. 11/10 would take to the open seas with https://t.co/0rRxyBQt32
778650543019483137,5787,1505,12577,145790,5733,17,8824231,"Meet Strider. He thinks he's a sorority girl. Already wants to go to NYC for a weekend to say he's ""studied abroad"" 10/10 https://t.co/KYZkPuiC1l"
778748913645780993,6923,1317,12577,145790,5733,17,8824231,"This is Mya (pronounced ""mmmyah?""). Her head is round af. 11/10 would pat accordingly https://t.co/1dpEuALnY0"
778990705243029504,20047,7218,12577,145790,5733,17,8824231,This is Jay. He's really h*ckin happy about the start of fall. Sneaky tongue slip in 2nd pic. 11/10 snuggly af https://t.co/vyx1X5eyWI
779056095788752897,14821,4552,12577,145790,5733,17,8824231,Everybody drop what you're doing and look at this dog. 13/10 must be super h*ckin rare https://t.co/I1bJUzUEW5
779377524342161408,8835,3121,12577,145790,5733,17,8824231,Have you ever seen such a smol pupper? Portable af. 12/10 would keep in shirt pocket https://t.co/KsqaIzlQ12
779834332596887552,18984,7062,12577,145790,5733,17,8824231,This is Scout. He really wants to kiss himself. H*ckin inappropriate. 11/10 narcissistic af https://t.co/x0gV2Ck3AD
780192070812196864,8755,2246,12577,145790,5733,17,8824231,We only rate dogs. Pls stop sending in non-canines like this Urban Floof Giraffe. I can't handle this. 11/10 https://t.co/zHIqpM5Gni
780459368902959104,5323,1083,12577,145790,5733,17,8824231,"This is Bear. Don't worry, he's not a real bear tho. Contains unreal amounts of squish. 11/10 heteroskedastic af https://t.co/coi4l1T2Sm"
780476555013349377,0,113,12577,145790,5733,17,8824231,"RT @Patreon: Well. @dog_rates is on Patreon. 

12/10. 

https://t.co/rnKvzt6RJs https://t.co/v4e2ywe8iO"
780496263422808064,0,3697,12577,145790,5733,17,8824232,RT @dog_rates: This is Bell. She likes holding hands. 12/10 would definitely pet with other hand https://t.co/BXIuvkQO9b
780543529827336192,6329,1750,12577,145790,5733,17,8824232,Here's a perturbed super floof. 12/10 would snug so damn well https://t.co/VG095mi09Q
780601303617732608,12181,3365,12577,145790,5733,17,8824232,Meet Hercules. He can have whatever he wants for the rest of eternity. 12/10 would snug passionately https://t.co/mH0IOyFdIG
780800785462489090,5513,1307,12577,145790,5733,17,8824233,This is Koda. He has a weird relationship with tall grass. Slightly concerning. 11/10 would def still pet https://t.co/KQzSR8eCsw
780858289093574656,7225,2021,12577,145790,5733,17,8824233,"This is Dash. He's very stylish, but also incredibly unimpressed with the current state of our nation. 10/10 would pet ears first https://t.co/YElO4hvXI6"
780931614150983680,21764,7350,12577,145790,5733,17,8824233,I want to finally rate this iconic puppo who thinks the parade is all for him. 13/10 would absolutely attend https://t.co/5dUYOu4b8d
781163403222056960,9866,2758,12577,145790,5733,17,8824233,"We normally don't rate lobsters, but this one appears to be a really good lobster. 10/10 would pet with caution https://t.co/YkHc7U7uUy"
781251288990355457,8494,2085,12577,145790,5733,17,8824233,This is Oakley. He just got yelled at for going 46 in a 45. Churlish af. 11/10 would still pet so well https://t.co/xIYsa6LPA4
781524693396357120,20860,5583,12577,145790,5733,17,8824232,Idk why this keeps happening. We only rate dogs. Not Bangladeshi Couch Chipmunks. Please only send dogs... 12/10 https://t.co/ya7bviQUUf
781661882474196992,10486,2726,12577,145790,5733,17,8824232,Who keeps sending in pictures without dogs in them? This needs to stop. 5/10 for the mediocre road https://t.co/ELqelxWMrC
781955203444699136,11196,3388,12577,145790,5733,17,8824232,This is Chipson. He weighed in at .3 ounces and is officially super h*ckin smol. Space-saving af. 11/10 would snug delicately https://t.co/FjEsk7A1JV
782021823840026624,0,6233,12577,145790,5733,17,8824232,RT @dog_rates: This is Harper. She scraped her elbow attempting a backflip off a tree. Valiant effort tho. 12/10 https://t.co/oHKJHghrp5
782305867769217024,16745,5598,12577,145790,5733,17,8824232,This is Sampson. He just graduated. Ready to be a doggo now. Time for the real world. 12/10 have fun with taxes https://t.co/pgVKxRw0s1
782598640137187329,7843,1886,12577,145790,5733,17,8824232,This is Timmy. He's quite large. According to a trusted source it's actually a dog wearing a dog suit. 11/10 https://t.co/BIUchFwHqn
782722598790725632,17368,5421,12577,145790,5733,17,8824232,"This is Penny. She fought a bee and the bee won. 10/10 you're fine Penny, everything's fine https://t.co/zrMVdfFej6"
782747134529531904,7513,1417,12577,145790,5733,17,8824232,This is Deacon. He's the happiest almost dry doggo I've ever seen. 11/10 would smile back https://t.co/C6fUMnHt1H
782969140009107456,24286,7415,12577,145790,5733,17,8824232,This is Cali. She arrived preassembled. Convenient af. 12/10 appears to be rather h*ckin pettable https://t.co/vOBV1ZqVcX
783085703974514689,8208,2214,12577,145790,5733,17,8824232,This is Earl. He can't catch. Did his best tho. 11/10 would repair confidence with extra pats https://t.co/IsqyvbjFgM
783334639985389568,29332,11734,12577,145790,5733,17,8824232,This is Dave. He's currently in a predicament. Doesn't seem to mind tho. 12/10 someone assist Dave https://t.co/nfprKAXqwu
783347506784731136,0,5580,12577,145790,5733,17,8824232,RT @dog_rates: This is Kenny. He just wants to be included in the happenings. 11/10 https://t.co/2S6oye3XqK
783391753726550016,16991,5508,12577,145790,5733,17,8824232,Meet Godi. He's an avid beachgoer and part time rainbow summoner. Eyeliner flawless af. 13/10 would snug well https://t.co/BO936YdJdi
783466772167098368,8522,2259,12577,145790,5733,17,8824232,This is Finn. He likes eavesdropping from filing cabinets. It's a real issue but no one has approached him about it. 11/10 would still pet https://t.co/s8W8Del9HQ
783695101801398276,10532,3235,12577,145790,5733,17,8824232,This is Loomis. He's the leader of the Kenneth search party. The passion is almost overwhelming. 12/10 one day he will be free https://t.co/kCRKlFg4AY
783821107061198850,7405,1990,12577,145790,5733,17,8824232,This is Mairi. She has mastered the art of camouflage. 12/10 h*ckin sneaky af https://t.co/STcPjiNAHp
783839966405230592,30252,10839,12577,145790,5733,17,8824232,This is Riley. His owner put a donut pillow around him and he loves it so much he won't let anyone take it off. 13/10 https://t.co/8TCQcsZCZ8
784431430411685888,5751,1279,12577,145790,5733,17,8824232,This is Stormy. He's curly af. Already pupared for Coachella next year. 12/10 https://t.co/PHA1vtqqpt
784517518371221505,9037,2557,12577,145790,5733,17,8824232,This is Frankie. He has yet to learn how to control his tongue. 11/10 maybe one day https://t.co/p6fgYe2dB6
784826020293709826,10171,3265,12577,145790,5733,17,8824232,This is Rusty. He's going D1 for sure. Insane vertical. 13/10 would draft https://t.co/AsykOwMrXQ
785170936622350336,12127,4870,12577,145790,5733,17,8824232,This is Hero. He was enjoying the car ride until he remembered that bees are dying globally at an alarming rate. 11/10 https://t.co/cubFg7F4qQ
785264754247995392,7319,1638,12577,145790,5733,17,8824232,This is Doc. He requested to be carried around like that. 12/10 anything for Doc https://t.co/mWYACm4qnx
785533386513321988,9193,2013,12577,145790,5733,17,8824232,This is Dallas. Her tongue is ridiculous. 11/10 h*ckin proud af https://t.co/h4jhlH4EyG
785639753186217984,7916,2254,12577,145790,5733,17,8824232,This is Pinot. He's a sophisticated doggo. You can tell by the hat. Also pointier than your average pupper. Still 10/10 would pet cautiously https://t.co/f2wmLZTPHd
785872687017132033,6749,1825,12577,145790,5733,17,8824232,Meet Rusty. He appears to be rather h*ckin fluffy. Also downright adorable af. 12/10 would rub my face against his https://t.co/1j9kLGb4wV
785927819176054784,11483,3207,12577,145790,5733,17,8824232,This is Lucy. She's strives to be the best potato she can be. 12/10 would boop https://t.co/lntsj7Fc4Y
786036967502913536,0,7062,12577,145790,5733,17,8824232,RT @dog_rates: This is Scout. He really wants to kiss himself. H*ckin inappropriate. 11/10 narcissistic af https://t.co/x0gV2Ck3AD
786233965241827333,15387,4771,12577,145790,5733,17,8824232,This is Mattie. She's extremely dangerous. Will bite your h*ckin finger right off. Still 11/10 would pet with caution https://t.co/78c9W8kLFh
786363235746385920,10974,3528,12577,145790,5733,17,8824232,This is Rizzo. He has many talents. A true renaissance doggo. 13/10 entertaining af https://t.co/TVXpEJB7Wn
786595970293370880,9528,3145,12577,145790,5733,17,8824232,This is Dale. He's a real spookster. Did me quite the frighten. 11/10 not too spooky to pet tho https://t.co/L8BWDD4oBX
786664955043049472,10675,2573,12577,145790,5733,17,8824232,"""Honestly Kathleen I just want more Ken Bone"" 12/10 https://t.co/HmlEvAMP4r"
786709082849828864,18376,6168,12577,145790,5733,17,8824232,"This is Logan, the Chow who lived. He solemnly swears he's up to lots of good. H*ckin magical af 9.75/10 https://t.co/yBO5wuqaPS"
786963064373534720,26863,8045,12577,145790,5733,17,8824232,This is Rory. He's got an interview in a few minutes. Looking spiffy af. Nervous as h*ck tho. 12/10 would hire https://t.co/ibj5g6xaAj
787322443945877504,7854,1754,12577,145790,5733,17,8824232,This is Lincoln. He forgot to use his blinker when he changed lanes just now. Guilty as h*ck. Still 10/10 https://t.co/lsrR83SiVp
787397959788929025,10990,2867,12577,145790,5733,17,8824232,This is Moose. He's rather h*ckin dangerous (you can tell by the collar). 11/10 would still attempt to snug https://t.co/lHVHGdDzb3
787717603741622272,10351,2796,12577,145790,5733,17,8824232,This is Tonks. She is a service puppo. Can hear a caterpillar hiccup from 7 miles away. 13/10 would follow anywhere https://t.co/i622ZbWkUp
787810552592695296,8688,3082,12577,145790,5733,17,8824232,This is Frank. He wears sunglasses and walks himself. 11/10 I'll never be this cool or independent https://t.co/pNNjBtHWPc
788039637453406209,6182,1330,12577,145790,5733,17,8824232,Did... did they pick out that license plate? 12/10 for both https://t.co/lRmUUOxgbQ
788070120937619456,0,3453,12577,145790,5733,17,8824232,RT @dog_rates: This is Bo and Ty. Bo eats paper and Ty felt left out. 11/10 for both https://t.co/1acHQS8rvK
788150585577050112,6178,1296,12577,145790,5733,17,8824232,This is Leo. He's a golden chow. Rather h*ckin rare. 13/10 would give extra pats https://t.co/xosHjFzVXc
788178268662984705,7293,2110,12577,145790,5733,17,8824232,Atlas is back and this time he's got doggles. Still 13/10 solarly conscious af https://t.co/s7MgFWDySc
788412144018661376,15698,5315,12577,145790,5733,17,8824232,This is Dexter. He breaks hearts for a living. 11/10 h*ckin handsome af https://t.co/4DhSsC1W7S
788765914992902144,27600,10397,12577,145790,5733,17,8824232,This is Butter. She can have whatever she wants forever. 12/10 would hug softly https://t.co/x5gXRS1abq
788908386943430656,27682,12593,12577,145790,5733,17,8824232,"This is Lucy. She destroyed not one, but two remotes trying to turn off the debate. 11/10 relatable af https://t.co/3BXh073tDm"
789137962068021249,9812,2814,12577,145790,5733,17,8824232,This is Bo. He's a West Congolese Bugaboop Snuggle. Rather exotic. Master of the head tilt. 12/10 would pay to pet https://t.co/2jwxxtNzoN
789268448748703744,9206,2628,12577,145790,5733,17,8824232,This is Stella. She's happier than I will ever be. 10/10 would trade lives with https://t.co/JSs2bfDtTS
789530877013393408,11830,3403,12577,145790,5733,17,8824232,This is Rizzy. She smiles a lot. 12/10 contagious af https://t.co/TU4sZogVIq
789599242079838210,6830,1945,12577,145791,5733,17,8824867,This is Brownie. She's wearing a Halloween themed onesie. 12/10 festive af https://t.co/0R4meWXFOx
789628658055020548,7566,1785,12577,145790,5733,17,8824232,This is Eli. He can fly. 13/10 magical af https://t.co/huPSJJ7FDI
789986466051088384,9346,2332,12577,145790,5733,17,8824232,This is Happy. He's a bathtub reviewer. Seems to be pleased with this one. 12/10 https://t.co/Ln89R4FP7v
790277117346975746,12692,3207,12577,145790,5733,17,8824232,This is Bruce. He never backs down from a challenge. 11/10 you got this Bruce https://t.co/aI7umZHIq7
790337589677002753,7904,1901,12577,145790,5733,17,8824232,Meet Maggie. She can hear your cells divide. 12/10 can also probably fly https://t.co/ovE2hqXryV
790581949425475584,20852,7212,12577,145790,5733,17,8824232,This is Duke. He sneaks into the fridge sometimes. It's his safe place. 11/10 would give little jacket if necessary https://t.co/Fd5WFDTMH4
790698755171364864,8299,1945,12577,145790,5733,17,8824232,This is Mosby. He appears to be rather h*ckin snuggable af. 12/10 keep it up Mosby https://t.co/IiiBq460I7
790723298204217344,0,2332,12577,145790,5733,17,8824232,RT @dog_rates: This is Happy. He's a bathtub reviewer. Seems to be pleased with this one. 12/10 https://t.co/Ln89R4FP7v
790946055508652032,16804,4735,12577,145790,5733,17,8824232,This is Betty. She's assisting with the dishes. Such a good puppo. 12/10 h*ckin helpful af https://t.co/dgvTPZ9tgI
790987426131050500,9919,2155,12577,145790,5733,17,8824232,This is Misty. She has a cowboy hat on her nose. 12/10 https://t.co/Eno0mypHIr
791026214425268224,0,4139,12577,145790,5733,17,8824232,RT @dog_rates: This is Alfie. He's touching a butt. Couldn't be happier. 11/10 https://t.co/gx3xF5mZbo
791312159183634433,8870,2563,12577,145790,5733,17,8824232,This is Mabel. She's super h*ckin smol. Portable af. Comes with the smol shoe. 12/10 would keep in frocket https://t.co/GGJvxYt3xK
791406955684368384,13259,4150,12577,145790,5733,17,8824232,Say hello to Levi. He's a Madagascan Butterbop. One of the more docile Butterbops I've seen. 12/10 would give all the pets https://t.co/Zcw9Sccctc
791672322847637504,11866,3166,12577,145790,5733,17,8824232,When she says you're a good boy and you know you're a good boy because you're a good boy. 13/10 https://t.co/O5IUmRHRIh
792050063153438720,7224,1816,12577,145790,5733,17,8824232,This is Remus. He's a mop that came to life. Can't see anything. Constantly trips over himself. Still a very good dog. 11/10 https://t.co/S3f1SYylzu
792394556390137856,13574,4332,12577,145790,5733,17,8824232,Meet BeBe. She rocks the messy bun of your dreams. H*ckin flawless. 12/10 would watch her tutorial https://t.co/of0pFNBIl8
792773781206999040,7428,1693,12577,145790,5733,17,8824232,This is Monster. Not an actual monster tho. He's showing you his tongue. Very impressive Monster. 12/10 would snug https://t.co/RhaPExuxJL
792883833364439040,11416,4313,12577,145790,5733,17,8824232,This is Bailey. She's rather h*ckin hype for Halloween tomorrow. Carved those pupkins herself. 12/10 https://t.co/v17mFm0Ftz
792913359805018113,14485,4022,12577,145790,5733,17,8824232,Here is a perfect example of someone who has their priorities in order. 13/10 for both owner and Forrest https://t.co/LRyMrU7Wfq
793120401413079041,12790,3960,12577,145790,5733,17,8824232,"This is Robin. She's desperately trying to do me a frighten, but her tongue drastically decreases her spook value. Still 11/10 great effort https://t.co/sxMrsOZ8zb"
793135492858580992,6481,2519,12577,145790,5733,17,8824232,Your favorite squad is looking extra h*ckin spooky today. 13/10 for all https://t.co/PrgvOyPtDT
793150605191548928,6238,1717,12577,145791,5733,17,8824867,This is Nida. She's a free elf. Waited so long for this day. 11/10 https://t.co/3lE8Izgmkf
793165685325201412,9507,2818,12577,145790,5733,17,8824232,This is Benji. He's Air Bud. It's a low effort costume but he pulls it off rather h*ckin well. 12/10 would happily get dunked on https://t.co/IbzT7DJvBo
793180763617361921,7006,2024,12577,145790,5733,17,8824232,This is Newt. He's a strawberry. 11/10 https://t.co/2VhmlwxA1Q
793195938047070209,15430,5687,12577,145790,5733,17,8824232,Say hello to Lily. She's pupset that her costume doesn't fit as well as last year. 12/10 poor puppo https://t.co/YSi6K1firY
793210959003287553,9016,2827,12577,145790,5733,17,8824233,This is Maude. She's the h*ckin happiest wasp you've ever seen. 10/10 would pet with caution https://t.co/etL8FHBrh8
793226087023144960,9935,2906,12577,145790,5733,17,8824234,"This is Juno. She spooked me up real good, but only to get my attention. Above average handwriting for a dog I think. 11/10 https://t.co/hFxxBCWlwj"
793241302385262592,10616,3326,12577,145790,5733,17,8824234,This is Tucker. He's out here bustin h*ckin ghosts. 13/10 dedicated af https://t.co/Ap477GhwXt
793256262322548741,20159,8416,12577,145790,5733,17,8824234,Oh h*ck look at this spookling right here. Fright level off the charts. 12/10 sufficiently spooked https://t.co/BNy9IIJMb0
793271401113350145,8792,2415,12577,145790,5733,17,8824234,Meet Dave. It's his favorite day of the year. He gets to fulfill his dream of being a dinosaur. 12/10 inspirational af https://t.co/MgQSdfZGPN
793286476301799424,24828,9258,12577,145790,5733,17,8824234,This is Moreton. He's the Good Boy Who Lived. 13/10 magical as h*ck https://t.co/rLHGx3VAF3
793500921481273345,10778,2397,12577,145790,5733,17,8824234,This is Fiona. She's an extremely mediocre copilot. Very distracting. Wink makes up for all the missed turns. 12/10 https://t.co/aF5MmpvPqN
793601777308463104,8063,1639,12577,145790,5733,17,8824234,This is Dobby. I can't stop looking at her feet. 12/10 would absolutely snug https://t.co/LhzPWv6rTv
793614319594401792,0,3166,12577,145790,5733,17,8824234,RT @dog_rates: When she says you're a good boy and you know you're a good boy because you're a good boy. 13/10 https://t.co/O5IUmRHRIh
793845145112371200,9319,1884,12577,145790,5733,17,8824234,This is Clark. He was just caught wearing pants. 13/10 game-changing af https://t.co/2Xo19aPrG5
793962221541933056,16997,4930,12577,145790,5733,17,8824234,This is Maximus. His face is stuck like that. Tragic really. Great tongue tho. 12/10 would pet firmly https://t.co/xIfrsMNLBR
794205286408003585,9316,3357,12577,145790,5733,17,8824234,This is Laika. She was a space pupper. The first space pupper actually. Orbited earth like a h*ckin boss. 14/10 hero af https://t.co/trSjgY3h4g
794332329137291264,9686,2713,12577,145790,5733,17,8824234,This is Nimbus (like the cloud). He just bought this fancy af duck raincoat. Only protects one ear tho. 12/10 so h*ckin floofy https://t.co/SIQbb8c3AU
794355576146903043,0,10397,12577,145790,5733,17,8824234,RT @dog_rates: This is Butter. She can have whatever she wants forever. 12/10 would hug softly https://t.co/x5gXRS1abq
794926597468000259,10346,2321,12577,145790,5733,17,8824234,This is Mack. He's rather h*ckin sleepy. Exceptional ears. 12/10 would boop https://t.co/XRPvTPF0VH
794983741416415232,0,3403,12577,145790,5733,17,8824234,RT @dog_rates: This is Rizzy. She smiles a lot. 12/10 contagious af https://t.co/TU4sZogVIq
795076730285391872,16361,5490,12577,145790,5733,17,8824234,This is Bailey. She loves going down slides but is very bad at it. Still 11/10 https://t.co/ivPWhspN3E
795400264262053889,10171,2899,12577,145790,5733,17,8824234,This is Brody. He's trying to make the same face as the football. 12/10 https://t.co/2H4MfOGlpQ
795464331001561088,50060,23848,12577,145790,5733,17,8824234,Elder doggo does a splash. Both 13/10 incredible stuff https://t.co/gBUDjdEcqz
796031486298386433,10917,3748,12577,145790,5733,17,8824234,This is Daisy. She's here to make your day better. 13/10 mission h*ckin successful https://t.co/PbgvuD0qIL
796080075804475393,8556,2331,12577,145790,5733,17,8824234,This is Yogi. He's 98% floof. Snuggable af. 12/10 https://t.co/opoXKxmfFm
796116448414461957,9198,2441,12577,145790,5733,17,8824234,I didn't believe it at first but now I can see that voter fraud is a serious h*ckin issue. 11/10 https://t.co/7i0bDMbrVN
796149749086875649,32577,14417,12577,145790,5733,17,8824234,This is Ruby. She just turned on the news. Officially terrified. 11/10 deep breaths Ruby https://t.co/y5KarNXWXt
796177847564038144,0,14417,12577,145790,5733,17,8824234,RT @dog_rates: This is Ruby. She just turned on the news. Officially terrified. 11/10 deep breaths Ruby https://t.co/y5KarNXWXt
796387464403357696,11119,4186,12577,145790,5733,17,8824234,This is Snicku. He's having trouble reading because he's a dog. Glasses only helped a little. Nap preferred. 12/10 would snug well https://t.co/cVLUasbKA5
796484825502875648,7654,1778,12577,145790,5733,17,8824234,Here's a sleepy doggo that requested some assistance. 12/10 would carry everywhere https://t.co/bvkkqOjNDV
796759840936919040,11953,3061,12577,145790,5733,17,8824234,Say hello to Romeo. He was just told that it's too cold for the pool. H*ckin nonsense. 11/10 would help fill up https://t.co/6hx7ur6sNI
796865951799083009,7772,1943,12577,145790,5733,17,8824234,This is Tyr. He's just checking on you. Nifty af tongue slip. 12/10 would absolutely pet https://t.co/Jgnuiyvq06
797236660651966464,20167,6652,12577,145790,5733,17,8824234,This is Pancake. She loves Batman and winks like a h*ckin champ. 12/10 real crowd pleaser https://t.co/6kqsAjJNhi
797545162159308800,14713,4915,12577,145790,5733,17,8824234,This is Cassie. She steals things. Guilt increases slightly each time. 12/10 would forgive almost immediately https://t.co/Ia19irLwyB
797971864723324932,11718,3144,12577,145790,5733,17,8824234,Here's a helicopter pupper. He takes off at random. H*ckin hard to control. 12/10 rare af https://t.co/GRWPgNKt2z
798209839306514432,10535,2592,12577,145790,5733,17,8824234,This is Cooper. His bow tie was too heavy for the front so he moved it to the side. Balanced af now. 13/10 https://t.co/jG1PAFkB81
798340744599797760,0,3365,12577,145790,5733,17,8824234,RT @dog_rates: This is Davey. He'll have your daughter home by 8. Just a stand up pup. 11/10 would introduce to mom https://t.co/E6bGWf9EOm
798628517273620480,0,1998,12577,145790,5733,17,8824234,RT @dog_rates: This a Norwegian Pewterschmidt named Tickles. Ears for days. 12/10 I care deeply for Tickles https://t.co/0aDF62KVP7
798644042770751489,0,1875,12577,145790,5733,17,8824234,RT @dog_rates: This is Paull. He just stubbed his toe. 10/10 deep breaths Paull https://t.co/J5Mqn8VeYq
798665375516884993,0,3954,12577,145790,5733,17,8824234,RT @dog_rates: This is Lola. She fell asleep on a piece of pizza. 10/10 frighteningly relatable https://t.co/eqmkr2gmPH
798673117451325440,0,5606,12577,145790,5733,17,8824234,"RT @dog_rates: I shall call him squishy and he shall be mine, and he shall be my squishy. 13/10 https://t.co/WId5lxNdPH"
798694562394996736,0,5007,12577,145790,5733,17,8824234,"RT @dog_rates: I'm not sure what's happening here, but it's pretty spectacular. 12/10 for both https://t.co/JKXh0NbBNL"
798697898615730177,0,6601,12577,145790,5733,17,8824234,RT @dog_rates: This is Stubert. He just arrived. 10/10 https://t.co/HVGs5aAKAn
798925684722855936,7588,1454,12577,145790,5733,17,8824234,This is Shadow. He's a firm believer that they're all good dogs. H*ckin passionate about it too. 11/10 I stand with Shadow https://t.co/8yvpacwBcu
798933969379225600,13225,4506,12577,145790,5733,17,8824234,This is Iroh. He's in a predicament. 12/10 someone help him https://t.co/KJAKO2kXsL
799063482566066176,8161,2495,12577,145790,5733,17,8824234,This is Mister. He only wears the most fashionable af headwear. 11/10 h*ckin stylish https://t.co/BXJFKOVnJm
799297110730567681,9993,2789,12577,145790,5733,17,8824234,This is Jeffrey. He's quite the jokester. Takes it too far sometimes. Still 11/10 would pet https://t.co/YDtZcAiMAf
799422933579902976,8159,1943,12577,145790,5733,17,8824234,This is Longfellow (prolly sophisticated). He's a North Appalachian Oatzenjammer. Concerned about wrinkled feets. 12/10 would hug softly https://t.co/bpLuQuxzHZ
799757965289017345,8484,2189,12577,145790,5733,17,8824234,This is Sobe. She's a h*ckin happy doggo. Only one leg tho. Must have good balance. 13/10 would smile back https://t.co/OiH8PaOxB1
